{
  "schemaVersion": 1,
  "toolVersion": "1.0.0",
  "stage": "DRAFT",
  "applicability": {
    "apple": "required",
    "googlePlay": "required",
    "firebase": "required",
    "github": "required"
  },
  "questionnaire": [
    {"key": "publisherLegalName", "prompt": "Publisher legal name", "type": "string", "required": true},
    {"key": "publisherAccountType", "prompt": "Publisher account type (individual or organization)", "type": "string", "required": true},
    {"key": "organizationNamespace", "prompt": "Owned reverse-domain organization namespace", "type": "string", "required": true},
    {"key": "defaultLocale", "prompt": "Default store locale", "type": "string", "required": true},
    {"key": "versionPolicy", "prompt": "Version and build-number policy", "type": "string", "required": true},
    {"key": "monetization", "prompt": "Monetization model (free, paid, IAP, subscription)", "type": "string", "required": true},
    {"key": "targetCountries", "prompt": "Target countries as a JSON array", "type": "list", "required": true},
    {"key": "supportEmail", "prompt": "Public support email", "type": "string", "required": true},
    {"key": "supportUrl", "prompt": "Public HTTPS support URL", "type": "string", "required": true},
    {"key": "privacyPolicyUrl", "prompt": "Public HTTPS privacy-policy URL", "type": "string", "required": true},
    {"key": "accountDeletionUrl", "prompt": "Public HTTPS account-deletion URL", "type": "string", "required": true},
    {"key": "marketingUrl", "prompt": "Marketing URL or notApplicable", "type": "string", "required": true},
    {"key": "storeTitle", "prompt": "Store title", "type": "string", "required": true},
    {"key": "shortDescription", "prompt": "Short store description", "type": "string", "required": true},
    {"key": "fullDescription", "prompt": "Full store description", "type": "string", "required": true},
    {"key": "category", "prompt": "Primary store category", "type": "string", "required": true},
    {"key": "contentRightsStatus", "prompt": "Content-rights declaration status", "type": "string", "required": true},
    {"key": "dataCollectionDeclarationStatus", "prompt": "Data collection/sharing declaration status", "type": "string", "required": true},
    {"key": "encryptionExportStatus", "prompt": "Encryption/export compliance status", "type": "string", "required": true},
    {"key": "adsStatus", "prompt": "Ads declaration", "type": "string", "required": true},
    {"key": "targetAudience", "prompt": "Target audience and age bands", "type": "string", "required": true},
    {"key": "releaseStrategy", "prompt": "Internal and production release strategy", "type": "string", "required": true},
    {"key": "assetsManifest", "prompt": "Approved store-assets manifest path", "type": "string", "required": true},
    {"key": "secret.privateStoreMetadata", "prompt": "Private review/contact/tester metadata file reference", "type": "secretReference", "required": true},

    {"key": "apple.membershipStatus", "prompt": "Apple Developer membership status", "type": "string", "required": true},
    {"key": "apple.teamId", "prompt": "Apple Team ID", "type": "string", "required": true},
    {"key": "apple.roles", "prompt": "App Store Connect roles", "type": "list", "required": true},
    {"key": "apple.agreementStatus", "prompt": "Apple agreements status", "type": "string", "required": true},
    {"key": "apple.bundleId", "prompt": "Production iOS bundle ID", "type": "string", "required": true},
    {"key": "apple.appRecordCreated", "prompt": "Initial App Store Connect record created by a human", "type": "bool", "required": true},
    {"key": "apple.appStoreConnectAppRecordId", "prompt": "App Store Connect app record ID", "type": "string", "required": true},
    {"key": "apple.sku", "prompt": "Immutable App Store SKU", "type": "string", "required": true},
    {"key": "apple.primaryLanguage", "prompt": "App Store primary language", "type": "string", "required": true},
    {"key": "apple.pricing", "prompt": "App Store pricing decision", "type": "string", "required": true},
    {"key": "apple.availability", "prompt": "App Store countries and availability", "type": "list", "required": true},
    {"key": "apple.testFlightGroups", "prompt": "TestFlight groups", "type": "list", "required": true},
    {"key": "apple.releaseMode", "prompt": "Manual, automatic, or scheduled App Store release", "type": "string", "required": true},
    {"key": "apple.dsaStatus", "prompt": "EU DSA trader status", "type": "string", "required": true},
    {"key": "apple.ageRatingStatus", "prompt": "Apple age-rating questionnaire status", "type": "string", "required": true},
    {"key": "apple.appPrivacyStatus", "prompt": "App Privacy declaration status", "type": "string", "required": true},
    {"key": "apple.exportComplianceStatus", "prompt": "Apple export-compliance status", "type": "string", "required": true},
    {"key": "apple.apiKeyId", "prompt": "App Store Connect API key ID", "type": "string", "required": true},
    {"key": "apple.issuerId", "prompt": "App Store Connect issuer ID", "type": "string", "required": true},
    {"key": "apple.apiKeyType", "prompt": "App Store Connect API key type", "type": "string", "required": true},
    {"key": "apple.apiKeyRole", "prompt": "App Store Connect API key role", "type": "string", "required": true},
    {"key": "apple.apiKeyCreatedAt", "prompt": "App Store Connect API key creation date", "type": "string", "required": true},
    {"key": "apple.signingStrategy", "prompt": "iOS signing strategy", "type": "string", "required": true},
    {"key": "apple.certificateFingerprint", "prompt": "Distribution certificate fingerprint", "type": "string", "required": true},
    {"key": "apple.certificateExpiry", "prompt": "Distribution certificate expiry", "type": "string", "required": true},
    {"key": "apple.profileUuid", "prompt": "Provisioning profile UUID", "type": "string", "required": true},
    {"key": "apple.profileExpiry", "prompt": "Provisioning profile expiry", "type": "string", "required": true},
    {"key": "apple.apnsKeyId", "prompt": "APNs key ID", "type": "string", "required": true},

    {"key": "googlePlay.accountStatus", "prompt": "Google Play developer account and verification status", "type": "string", "required": true},
    {"key": "googlePlay.developerId", "prompt": "Google Play developer ID", "type": "string", "required": true},
    {"key": "googlePlay.agreementStatus", "prompt": "Google Play agreements status", "type": "string", "required": true},
    {"key": "googlePlay.appRecordCreated", "prompt": "Initial Google Play Console app record created by a human", "type": "bool", "required": true},
    {"key": "googlePlay.applicationId", "prompt": "Production Android application ID", "type": "string", "required": true},
    {"key": "googlePlay.defaultLanguage", "prompt": "Google Play default language", "type": "string", "required": true},
    {"key": "googlePlay.appOrGame", "prompt": "Google Play app or game choice", "type": "string", "required": true},
    {"key": "googlePlay.freeOrPaid", "prompt": "Google Play free or paid choice", "type": "string", "required": true},
    {"key": "googlePlay.countries", "prompt": "Google Play countries", "type": "list", "required": true},
    {"key": "googlePlay.tracks", "prompt": "Google Play test and production tracks", "type": "list", "required": true},
    {"key": "googlePlay.categoryTags", "prompt": "Google Play category and tags", "type": "list", "required": true},
    {"key": "googlePlay.managedPublishing", "prompt": "Use Google Play managed publishing", "type": "bool", "required": true},
    {"key": "googlePlay.playSigningStatus", "prompt": "Play App Signing status", "type": "string", "required": true},
    {"key": "googlePlay.uploadCertificateFingerprint", "prompt": "Android upload certificate fingerprint", "type": "string", "required": true},
    {"key": "googlePlay.cloudProject", "prompt": "Google Cloud project ID", "type": "string", "required": true},
    {"key": "googlePlay.playDeveloperApiEnabled", "prompt": "Google Play Developer API enabled", "type": "bool", "required": true},
    {"key": "googlePlay.publishingIdentity", "prompt": "Least-privilege publishing identity", "type": "string", "required": true},
    {"key": "googlePlay.wifProvider", "prompt": "Workload Identity Federation provider", "type": "string", "required": true},
    {"key": "googlePlay.dataSafetyStatus", "prompt": "Google Play Data Safety status", "type": "string", "required": true},
    {"key": "googlePlay.contentRatingStatus", "prompt": "Google Play content rating status", "type": "string", "required": true},
    {"key": "googlePlay.appAccessStatus", "prompt": "Google Play app-access declaration status", "type": "string", "required": true},
    {"key": "secret.testerLists", "prompt": "Private tester-list file reference", "type": "secretReference", "required": true},

    {"key": "firebase.projectMapping", "prompt": "Firebase dev/staging/prod project mapping", "type": "string", "required": true},
    {"key": "firebase.iosAppIds", "prompt": "Firebase iOS app IDs", "type": "list", "required": true},
    {"key": "firebase.androidAppIds", "prompt": "Firebase Android app IDs", "type": "list", "required": true},
    {"key": "firebase.authProviders", "prompt": "Enabled Firebase auth providers", "type": "list", "required": true},
    {"key": "firebase.appCheckStatus", "prompt": "Firebase App Check status", "type": "string", "required": true},

    {"key": "github.repository", "prompt": "GitHub owner/repository", "type": "string", "required": true},
    {"key": "github.internalEnvironment", "prompt": "Internal release environment", "type": "string", "required": true},
    {"key": "github.productionEnvironment", "prompt": "Production release environment", "type": "string", "required": true},
    {"key": "github.reviewers", "prompt": "Required GitHub environment reviewers", "type": "list", "required": true},